{
  "$schema": "../../../schemas/task-manifest.schema.json",
  "schema_version": "1.0",
  "task_id": "phase8-routine-develop-pass",
  "created_at": "2026-07-30T10:00:00Z",
  "raw_request": "更新工作流程說明文件。",
  "action": "develop",
  "task_type": "change",
  "role_id": "developer",
  "skill_ids": [],
  "targets": ["docs"],
  "target_mode": "single",
  "project": {
    "project_id": "controlled-agent-workflow",
    "project_root": ".",
    "config_path": "project.config.json"
  },
  "modules": [],
  "scope": {
    "summary": "Update workflow documentation without a module contract.",
    "include_paths": ["AI-Workflow/README.md"],
    "exclude_paths": [],
    "change_source": "request"
  },
  "routing_triggers": [],
  "review_mode": null,
  "analysis_mode": null,
  "provenance": {
    "action": {"source": "inference", "confidence": 0.95, "evidence": ["更新"], "candidates": ["develop"]},
    "task_type": {"source": "inference", "confidence": 0.95, "evidence": ["更新"], "candidates": ["change"]},
    "role_id": {"source": "registry", "confidence": 1.0, "evidence": ["develop maps to developer"], "candidates": ["developer"]},
    "skill_ids": {"source": "registry", "confidence": 1.0, "evidence": ["No explicit or mandatory Skill applies"], "candidates": []},
    "targets": {"source": "inference", "confidence": 0.95, "evidence": ["說明文件"], "candidates": ["docs"]},
    "modules": {"source": "inference", "confidence": 1.0, "evidence": ["No module is named"], "candidates": []},
    "scope": {"source": "inference", "confidence": 0.95, "evidence": ["工作流程說明文件"], "candidates": ["AI-Workflow/README.md"]},
    "routing_triggers": {"source": "inference", "confidence": 1.0, "evidence": ["No structural trigger"], "candidates": []},
    "review_mode": {"source": "inference", "confidence": 1.0, "evidence": ["action is develop"], "candidates": []},
    "analysis_mode": {"source": "inference", "confidence": 1.0, "evidence": ["action is develop"], "candidates": []}
  },
  "unresolved": [],
  "status": "analyzed"
}
