{
  "$schema": "../../../schemas/task-manifest.schema.json",
  "schema_version": "1.0",
  "task_id": "fixture-valid-frontend-bugfix",
  "created_at": "2026-07-30T09:00:00Z",
  "raw_request": "修正午餐訂單列表無法更新付款狀態的問題。",
  "action": "develop",
  "task_type": "bugfix",
  "role_id": "developer",
  "skill_ids": [],
  "targets": ["frontend"],
  "target_mode": "single",
  "project": {
    "project_id": "controlled-agent-workflow",
    "project_root": ".",
    "config_path": ".ai-workflow/project.config.json"
  },
  "modules": [
    {
      "module_id": "lunch",
      "name": "Lunch",
      "aliases": ["lunch"],
      "candidate_paths": []
    }
  ],
  "scope": {
    "summary": "Update the Lunch frontend payment-state behavior.",
    "include_paths": [],
    "exclude_paths": [],
    "change_source": "request"
  },
  "routing_triggers": [],
  "review_mode": null,
  "analysis_mode": null,
  "provenance": {
    "action": {
      "source": "inference",
      "confidence": 0.95,
      "evidence": ["修正"],
      "candidates": ["develop"]
    },
    "task_type": {
      "source": "inference",
      "confidence": 0.95,
      "evidence": ["問題"],
      "candidates": ["bugfix"]
    },
    "role_id": {
      "source": "registry",
      "confidence": 1.0,
      "evidence": ["action=develop maps to developer"],
      "candidates": ["developer"]
    },
    "skill_ids": {
      "source": "registry",
      "confidence": 1.0,
      "evidence": ["No explicit or mandatory skill applies"],
      "candidates": []
    },
    "targets": {
      "source": "inference",
      "confidence": 0.92,
      "evidence": ["列表"],
      "candidates": ["frontend"]
    },
    "modules": {
      "source": "registry",
      "confidence": 1.0,
      "evidence": ["Exact module alias lunch"],
      "candidates": ["lunch"]
    },
    "scope": {
      "source": "inference",
      "confidence": 0.95,
      "evidence": ["更新付款狀態"],
      "candidates": ["request"]
    },
    "routing_triggers": {
      "source": "inference",
      "confidence": 1.0,
      "evidence": ["No deterministic routing trigger"],
      "candidates": []
    },
    "review_mode": {
      "source": "inference",
      "confidence": 1.0,
      "evidence": ["action is develop"],
      "candidates": []
    },
    "analysis_mode": {
      "source": "inference",
      "confidence": 1.0,
      "evidence": ["action is develop"],
      "candidates": []
    }
  },
  "unresolved": ["module context remains unbound and must block at preflight"],
  "status": "needs-resolution"
}
